{
  "$schema": "https://json-schema.org/draft/2020-12/schema",
  "$id": "statusline-file",
  "type": "object",
  "required": ["schema", "received_at", "received_ns", "payload", "git_branch", "cost_sample", "burn_usd_per_hour", "pid", "pid_started_at"],
  "properties": {
    "schema": { "const": 1 },
    "received_at": { "$ref": "defs#/$defs/timestamp" },
    "received_ns": { "type": "integer", "minimum": 0, "maximum": 9223372036854775807, "description": "Unix nanoseconds when the tick started; orders overlapping ticks." },
    "payload": { "type": "object" },
    "git_branch": { "anyOf": [{ "$ref": "defs#/$defs/text" }, { "type": "null" }] },
    "cost_sample": {
      "type": ["object", "null"],
      "required": ["at", "usd"],
      "properties": {
        "at": { "$ref": "defs#/$defs/timestamp" },
        "usd": { "type": "number", "minimum": 0 }
      },
      "additionalProperties": false
    },
    "burn_usd_per_hour": { "type": ["number", "null"], "minimum": 0 },
    "pid": { "type": ["integer", "null"], "minimum": 1, "maximum": 9007199254740991 },
    "pid_started_at": { "$ref": "lifecycle-file#/$defs/pid_started_at" }
  },
  "additionalProperties": false
}
